{"authority_scope":"public_synthetic_probe_execution_only","counts":{"cases_distinct":8,"cases_in":8,"cases_out":8,"critical_failure":6,"gaps":0,"invented_values":0,"legacy_inline":0,"retrieval_error":6,"semantic_correct":2,"skeleton_match":2},"evaluation_sha256":"sha256:f23922fab9359929fc1de5c4b6617dfd3bb404e51fb615669674325618f78bbe","execution":{"freeze_raw_sha256":"sha256:d9b0c4c815cfaf61c4e1c35f8060e63696fefee75157f4a7ebf306606f7afe75","freeze_sha256":"sha256:a94ccea8684cb7109d6568d86c91a8ca4fea344ad6e0bfc6422825a847b8aa81","head":"a4d778d51ae80371223bef760cd99170e6d96662","preimage_commit":"6c6350a62003953f8b60f271f9da692ef43b772c","preimage_tree":"93082730c3550243a8fc80c29defbeae98f80f42","report_sha256":"sha256:82edcd28501eb9abf7bc610cd03e534f7267f43403ee67ada7867155c95328a6","run_dir":"artifacts/catalog-maintenance-probe-v1","stderr_sha256":"sha256:e3b0c44298fc1c149afbf4c8996fb92427ae41e4649b934ca495991b7852b855","tree":"9674c0a8b7c9687b6506deba191657cdcc447e0b"},"model":{"adapter_enabled":false,"family":"Qwen3.8","seed":17,"temperature":0},"nonclaims":["no_accuracy_claim","no_promotion_claim","no_training_authority","no_tenant_dataset_authority","no_independent_accuracy_denominator"],"policy":{"accuracy_claim":false,"failure_action":"diagnostic_only","promotion_claim":false,"training_authorized":false,"verdict":"DIAGNOSE"},"roster":{"cases":[{"attempt_text_hashes_distinct":1,"attempts":3,"attempts_file_sha256":"sha256:8c8ee5d1f6e108dac06cbd7a66b8967d52870f982f92c4c0871dfb698ce4ea82","case_id":"author-enum3","failure_codes":["missing_metis_0_43_prefix"],"final_score":{"critical_failure":1,"invented_values":0,"legacy_inline":0,"retrieval_error":1,"semantic_correct":0,"skeleton_match":false},"root_id":"root/catalog-enum3-author-v1"},{"attempt_text_hashes_distinct":1,"attempts":3,"attempts_file_sha256":"sha256:b521f5d27e56814706a5c9f406a5c61944ed46b2b02fd7fedd50e9b5a3708895","case_id":"author-open","failure_codes":["missing_metis_0_43_prefix"],"final_score":{"critical_failure":1,"invented_values":0,"legacy_inline":0,"retrieval_error":1,"semantic_correct":0,"skeleton_match":false},"root_id":"root/catalog-open-author-v1"},{"attempt_text_hashes_distinct":1,"attempts":3,"attempts_file_sha256":"sha256:e2d735c14ea61090999f8639954f0b667fe3e2b5dcbb9d1ee3a585d1c7d844e9","case_id":"author-inline-tiny","failure_codes":["missing_metis_0_43_prefix"],"final_score":{"critical_failure":1,"invented_values":0,"legacy_inline":0,"retrieval_error":1,"semantic_correct":0,"skeleton_match":false},"root_id":"root/catalog-inline-author-v1"},{"attempt_text_hashes_distinct":1,"attempts":3,"attempts_file_sha256":"sha256:727703c45528e0a47149f5bde81b2c22eadf5077f37a517ad14aec64a847567b","case_id":"author-nested-enum2","failure_codes":["missing_metis_0_43_prefix"],"final_score":{"critical_failure":1,"invented_values":0,"legacy_inline":0,"retrieval_error":1,"semantic_correct":0,"skeleton_match":false},"root_id":"root/catalog-nested-enum-author-v1"},{"attempt_text_hashes_distinct":1,"attempts":3,"attempts_file_sha256":"sha256:29806d46266217022b5f87fde3ca79e0bb75ef3bb994bf8432667a2aadac5d8a","case_id":"edit-inline4-to-enum4","failure_codes":["catalog describe rejected candidate"],"final_score":{"critical_failure":1,"invented_values":0,"legacy_inline":0,"retrieval_error":1,"semantic_correct":0,"skeleton_match":false},"root_id":"root/catalog-inline4-edit-v1"},{"attempt_text_hashes_distinct":1,"attempts":1,"attempts_file_sha256":"sha256:2cc7ba6f53bda518be02f77744e6b474aa7e5295d314f0d03504ec2128de3eae","case_id":"edit-invalid-open-inline","failure_codes":[],"final_score":{"critical_failure":0,"invented_values":0,"legacy_inline":0,"retrieval_error":0,"semantic_correct":1,"skeleton_match":true},"root_id":"root/catalog-open-invalid-edit-v1"},{"attempt_text_hashes_distinct":1,"attempts":1,"attempts_file_sha256":"sha256:9c24d4ebfb4ade30731059aa8381258936380b619fea81b7d5f24650357bd374","case_id":"repair-unsynchronized-enum","failure_codes":[],"final_score":{"critical_failure":0,"invented_values":0,"legacy_inline":0,"retrieval_error":0,"semantic_correct":1,"skeleton_match":true},"root_id":"root/catalog-unsynchronized-repair-v1"},{"attempt_text_hashes_distinct":1,"attempts":3,"attempts_file_sha256":"sha256:6fc957b9ed6d14b0b602553468695ddc1b9c80014612387157d899f8945f5600","case_id":"author-retrieval-curated","failure_codes":["missing_metis_0_43_prefix"],"final_score":{"critical_failure":1,"invented_values":0,"legacy_inline":0,"retrieval_error":1,"semantic_correct":0,"skeleton_match":false},"root_id":"root/catalog-retrieval-boundary-v1"}],"cases_distinct":8,"cases_in":8,"cases_out":8,"gaps":0},"schema_version":1,"status":"verified_local_cooperative","veto_counts":{"critical_failure":6,"invented_values":0,"legacy_inline":0,"retrieval_error":6}}
